{
  "$schema": "https://json-schema.org/draft/2020-12/schema",
  "$id": "external_analyzer_results.schema.json",
  "title": "External Analyzer Results",
  "type": "object",
  "required": ["tool", "results"],
  "properties": {
    "tool": { "type": "string" },
    "generated_at": { "type": "string" },
    "ownership_roots": {
      "type": "array",
      "description": "Optional analyzer-supplied ownership roots. Each root says a bounded set of checked-in paths belongs to the same module or package root and is translated into graph reference edges.",
      "items": {
        "type": "object",
        "required": ["root", "paths"],
        "properties": {
          "root": {
            "type": "string",
            "description": "Repository-relative ownership root directory."
          },
          "paths": {
            "type": "array",
            "minItems": 1,
            "items": { "type": "string" },
            "description": "Repository-relative files known to belong to this root."
          },
          "kind": {
            "type": "string",
            "description": "Optional analyzer-specific ownership kind, such as 'python-package' or 'module'."
          },
          "confidence": {
            "type": "number",
            "minimum": 0,
            "maximum": 1,
            "description": "Analyzer confidence for the ownership hint."
          },
          "reason": {
            "type": "string",
            "description": "Short explanation of why the analyzer emitted this root."
          }
        },
        "additionalProperties": false
      }
    },
    "results": {
      "type": "array",
      "items": {
        "type": "object",
        "required": ["id", "category", "severity", "path", "summary"],
        "properties": {
          "id": { "type": "string" },
          "category": {
            "type": "string",
            "description": "Free-form category string from the originating tool (e.g. 'security/injection', 'style/lint'). Mapped to audit lenses by analyzerCategoryToLenses."
          },
          "severity": {
            "type": "string",
            "enum": ["critical", "high", "medium", "low", "info"]
          },
          "path": { "type": "string" },
          "line_start": { "type": "integer" },
          "line_end": { "type": "integer" },
          "summary": { "type": "string" },
          "rule": { "type": "string" },
          "raw": {}
        },
        "additionalProperties": false
      }
    }
  },
  "additionalProperties": false
}
